{
  "$schema": "https://json-schema.org/draft/2020-12/schema",
  "$id": "https://example.invalid/commerce/contracts/data-product.schema.json",
  "title": "Commerce reusable data product contract",
  "type": "object",
  "additionalProperties": false,
  "properties": {
    "name": {
      "type": "string",
      "pattern": "^[a-z][a-z0-9_]*$"
    },
    "business_description": {
      "type": "string",
      "minLength": 20
    },
    "owner": {
      "type": "object",
      "additionalProperties": false,
      "properties": {
        "team": {
          "type": "string"
        },
        "contact": {
          "type": "string"
        }
      },
      "required": [
        "team",
        "contact"
      ]
    },
    "contract_version": {
      "type": "string",
      "pattern": "^\\d+\\.\\d+\\.\\d+$"
    },
    "status": {
      "type": "string",
      "enum": [
        "design",
        "local_verified",
        "aws_verified"
      ]
    },
    "layer": {
      "type": "string",
      "enum": [
        "silver",
        "gold"
      ]
    },
    "grain": {
      "type": "string",
      "minLength": 10
    },
    "primary_key": {
      "type": "array",
      "minItems": 1,
      "uniqueItems": true,
      "items": {
        "type": "string"
      }
    },
    "columns": {
      "type": "array",
      "minItems": 1,
      "items": {
        "type": "object",
        "additionalProperties": false,
        "properties": {
          "name": {
            "type": "string",
            "pattern": "^[a-z][a-z0-9_]*$"
          },
          "type": {
            "type": "string",
            "enum": [
              "string",
              "int64",
              "float64",
              "boolean",
              "timestamp",
              "date"
            ]
          },
          "nullable": {
            "type": "boolean"
          },
          "description": {
            "type": "string",
            "minLength": 1
          }
        },
        "required": [
          "name",
          "type",
          "nullable",
          "description"
        ]
      }
    },
    "freshness_sla": {
      "type": "object",
      "additionalProperties": false,
      "properties": {
        "max_lag_seconds": {
          "type": "integer",
          "minimum": 1
        },
        "measurement": {
          "type": "string"
        },
        "objective_ratio": {
          "type": "number",
          "minimum": 0,
          "maximum": 1
        },
        "evaluation_window": {
          "type": "string"
        },
        "enforcement": {
          "type": "string",
          "enum": [
            "target_unmeasured",
            "measured"
          ]
        }
      },
      "required": [
        "max_lag_seconds",
        "measurement",
        "objective_ratio",
        "evaluation_window",
        "enforcement"
      ]
    },
    "completeness_sla": {
      "type": "object",
      "additionalProperties": false,
      "properties": {
        "minimum_ratio": {
          "type": "number",
          "minimum": 0,
          "maximum": 1
        },
        "allowed_lateness_seconds": {
          "type": "integer",
          "minimum": 0
        },
        "denominator": {
          "type": "string"
        },
        "measurement": {
          "type": "string"
        },
        "enforcement": {
          "type": "string",
          "enum": [
            "target_unmeasured",
            "measured"
          ]
        }
      },
      "required": [
        "minimum_ratio",
        "allowed_lateness_seconds",
        "denominator",
        "measurement",
        "enforcement"
      ]
    },
    "quality_rules": {
      "type": "array",
      "minItems": 1,
      "items": {
        "type": "object",
        "additionalProperties": false,
        "properties": {
          "id": {
            "type": "string",
            "pattern": "^[a-z][a-z0-9_]*$"
          },
          "type": {
            "type": "string",
            "enum": [
              "not_null",
              "unique",
              "accepted_values",
              "numeric_range",
              "timestamp_sanity",
              "referential_integrity",
              "duplicate_event",
              "lifecycle_transition",
              "freshness",
              "completeness"
            ]
          },
          "severity": {
            "type": "string",
            "enum": [
              "error",
              "warning"
            ]
          },
          "columns": {
            "type": "array",
            "minItems": 1,
            "uniqueItems": true,
            "items": {
              "type": "string"
            }
          },
          "parameters": {
            "type": "object"
          },
          "description": {
            "type": "string",
            "minLength": 1
          }
        },
        "required": [
          "id",
          "type",
          "severity",
          "columns",
          "parameters",
          "description"
        ],
        "allOf": [
          {
            "if": {
              "properties": {
                "type": {
                  "const": "not_null"
                }
              }
            },
            "then": {
              "properties": {
                "parameters": {
                  "type": "object",
                  "additionalProperties": false,
                  "properties": {},
                  "required": []
                }
              }
            }
          },
          {
            "if": {
              "properties": {
                "type": {
                  "const": "unique"
                }
              }
            },
            "then": {
              "properties": {
                "parameters": {
                  "type": "object",
                  "additionalProperties": false,
                  "properties": {},
                  "required": []
                }
              }
            }
          },
          {
            "if": {
              "properties": {
                "type": {
                  "const": "accepted_values"
                }
              }
            },
            "then": {
              "properties": {
                "parameters": {
                  "type": "object",
                  "additionalProperties": false,
                  "properties": {
                    "values": {
                      "type": "array",
                      "minItems": 1,
                      "items": {
                        "type": [
                          "string",
                          "number",
                          "boolean"
                        ]
                      }
                    }
                  },
                  "required": [
                    "values"
                  ]
                }
              }
            }
          },
          {
            "if": {
              "properties": {
                "type": {
                  "const": "numeric_range"
                }
              }
            },
            "then": {
              "properties": {
                "parameters": {
                  "type": "object",
                  "additionalProperties": false,
                  "properties": {
                    "minimum": {
                      "type": [
                        "number",
                        "null"
                      ]
                    },
                    "maximum": {
                      "type": [
                        "number",
                        "null"
                      ]
                    }
                  },
                  "required": [
                    "minimum",
                    "maximum"
                  ]
                }
              }
            }
          },
          {
            "if": {
              "properties": {
                "type": {
                  "const": "timestamp_sanity"
                }
              }
            },
            "then": {
              "properties": {
                "parameters": {
                  "type": "object",
                  "additionalProperties": false,
                  "properties": {
                    "reference_column": {
                      "type": [
                        "string",
                        "null"
                      ]
                    },
                    "max_future_seconds": {
                      "type": "integer",
                      "minimum": 0
                    }
                  },
                  "required": [
                    "reference_column",
                    "max_future_seconds"
                  ]
                }
              }
            }
          },
          {
            "if": {
              "properties": {
                "type": {
                  "const": "referential_integrity"
                }
              }
            },
            "then": {
              "properties": {
                "parameters": {
                  "type": "object",
                  "additionalProperties": false,
                  "properties": {
                    "reference_product": {
                      "type": "string"
                    },
                    "reference_columns": {
                      "type": "array",
                      "minItems": 1,
                      "items": {
                        "type": "string"
                      }
                    },
                    "grace_seconds": {
                      "type": "integer",
                      "minimum": 0
                    }
                  },
                  "required": [
                    "reference_product",
                    "reference_columns",
                    "grace_seconds"
                  ]
                }
              }
            }
          },
          {
            "if": {
              "properties": {
                "type": {
                  "const": "duplicate_event"
                }
              }
            },
            "then": {
              "properties": {
                "parameters": {
                  "type": "object",
                  "additionalProperties": false,
                  "properties": {
                    "semantic_digest_column": {
                      "type": "string"
                    },
                    "identity_columns": {
                      "type": "array",
                      "minItems": 1,
                      "items": {
                        "type": "string"
                      }
                    }
                  },
                  "required": [
                    "semantic_digest_column",
                    "identity_columns"
                  ]
                }
              }
            }
          },
          {
            "if": {
              "properties": {
                "type": {
                  "const": "lifecycle_transition"
                }
              }
            },
            "then": {
              "properties": {
                "parameters": {
                  "type": "object",
                  "additionalProperties": false,
                  "properties": {
                    "entity_columns": {
                      "type": "array",
                      "minItems": 1,
                      "items": {
                        "type": "string"
                      }
                    },
                    "sequence_column": {
                      "type": "string"
                    },
                    "allowed_transitions": {
                      "type": "array",
                      "items": {
                        "type": "array",
                        "minItems": 2,
                        "maxItems": 2,
                        "items": {
                          "type": "string"
                        }
                      }
                    }
                  },
                  "required": [
                    "entity_columns",
                    "sequence_column",
                    "allowed_transitions"
                  ]
                }
              }
            }
          },
          {
            "if": {
              "properties": {
                "type": {
                  "const": "freshness"
                }
              }
            },
            "then": {
              "properties": {
                "parameters": {
                  "type": "object",
                  "additionalProperties": false,
                  "properties": {
                    "max_age_seconds": {
                      "type": "integer",
                      "minimum": 1
                    },
                    "clock": {
                      "type": "string",
                      "enum": [
                        "evaluation_time_utc"
                      ]
                    }
                  },
                  "required": [
                    "max_age_seconds",
                    "clock"
                  ]
                }
              }
            }
          },
          {
            "if": {
              "properties": {
                "type": {
                  "const": "completeness"
                }
              }
            },
            "then": {
              "properties": {
                "parameters": {
                  "type": "object",
                  "additionalProperties": false,
                  "properties": {
                    "minimum_ratio": {
                      "type": "number",
                      "minimum": 0,
                      "maximum": 1
                    },
                    "expected_population": {
                      "type": "string",
                      "minLength": 1
                    }
                  },
                  "required": [
                    "minimum_ratio",
                    "expected_population"
                  ]
                }
              }
            }
          }
        ]
      }
    },
    "lineage": {
      "type": "object",
      "additionalProperties": false,
      "properties": {
        "sources": {
          "type": "array",
          "minItems": 1,
          "items": {
            "type": "string"
          }
        },
        "transformation": {
          "type": "string"
        },
        "downstream_consumers": {
          "type": "array",
          "items": {
            "type": "string"
          }
        }
      },
      "required": [
        "sources",
        "transformation",
        "downstream_consumers"
      ]
    },
    "usage_metadata": {
      "type": "object",
      "additionalProperties": false,
      "properties": {
        "intended_uses": {
          "type": "array",
          "minItems": 1,
          "items": {
            "type": "string"
          }
        },
        "prohibited_uses": {
          "type": "array",
          "items": {
            "type": "string"
          }
        },
        "classification": {
          "const": "synthetic_public"
        },
        "access_pattern": {
          "type": "string"
        },
        "retention_days": {
          "type": "integer",
          "minimum": 1
        }
      },
      "required": [
        "intended_uses",
        "prohibited_uses",
        "classification",
        "access_pattern",
        "retention_days"
      ]
    },
    "cost_metadata": {
      "type": "object",
      "additionalProperties": false,
      "properties": {
        "measurement_status": {
          "type": "string",
          "enum": [
            "not_measured",
            "measured"
          ]
        },
        "period_start": {
          "anyOf": [
            {
              "type": "string",
              "format": "date-time",
              "pattern": "^\\d{4}-\\d{2}-\\d{2}T\\d{2}:\\d{2}:\\d{2}(?:\\.\\d{1,6})?Z$"
            },
            {
              "type": "null"
            }
          ]
        },
        "period_end": {
          "anyOf": [
            {
              "type": "string",
              "format": "date-time",
              "pattern": "^\\d{4}-\\d{2}-\\d{2}T\\d{2}:\\d{2}:\\d{2}(?:\\.\\d{1,6})?Z$"
            },
            {
              "type": "null"
            }
          ]
        },
        "currency": {
          "const": "USD"
        },
        "compute_usd": {
          "type": [
            "number",
            "null"
          ],
          "minimum": 0
        },
        "storage_bytes": {
          "type": [
            "integer",
            "null"
          ],
          "minimum": 0
        },
        "allocation_method": {
          "type": "string"
        }
      },
      "required": [
        "measurement_status",
        "period_start",
        "period_end",
        "currency",
        "compute_usd",
        "storage_bytes",
        "allocation_method"
      ]
    }
  },
  "required": [
    "name",
    "business_description",
    "owner",
    "contract_version",
    "status",
    "layer",
    "grain",
    "primary_key",
    "columns",
    "freshness_sla",
    "completeness_sla",
    "quality_rules",
    "lineage",
    "usage_metadata",
    "cost_metadata"
  ]
}
