{
  "name": "delivery_reliability",
  "business_description": "Regional daily customer delivery reliability, preserving delivered and attempted cohorts for transparent denominators.",
  "owner": {
    "team": "Fictional Commerce Data Platform",
    "contact": "repository:CODEOWNERS"
  },
  "contract_version": "1.0.0",
  "status": "local_verified",
  "layer": "gold",
  "grain": "One row per destination country, region and UTC metric_date with an effective delivery outcome.",
  "primary_key": [
    "country",
    "region",
    "metric_date"
  ],
  "columns": [
    {
      "name": "country",
      "type": "string",
      "nullable": false,
      "description": "Destination country."
    },
    {
      "name": "region",
      "type": "string",
      "nullable": false,
      "description": "Destination subdivision."
    },
    {
      "name": "metric_date",
      "type": "date",
      "nullable": false,
      "description": "UTC date of delivered or failed attempt outcome."
    },
    {
      "name": "delivered_shipments",
      "type": "int64",
      "nullable": false,
      "description": "Distinct shipments delivered during the day."
    },
    {
      "name": "on_time_deliveries",
      "type": "int64",
      "nullable": false,
      "description": "Delivered shipments meeting original dispatch promise."
    },
    {
      "name": "late_deliveries",
      "type": "int64",
      "nullable": false,
      "description": "Delivered shipments missing original dispatch promise."
    },
    {
      "name": "completed_delivery_attempts",
      "type": "int64",
      "nullable": false,
      "description": "Distinct attempts with a delivery or failure outcome on this day."
    },
    {
      "name": "failed_delivery_attempts",
      "type": "int64",
      "nullable": false,
      "description": "Distinct failed attempts with outcome on this day."
    },
    {
      "name": "on_time_delivery_rate",
      "type": "float64",
      "nullable": true,
      "description": "on_time_deliveries / delivered_shipments; null if no delivered shipments."
    },
    {
      "name": "failed_delivery_rate",
      "type": "float64",
      "nullable": true,
      "description": "failed_delivery_attempts / completed_delivery_attempts; null if no outcomes."
    },
    {
      "name": "p95_transit_seconds",
      "type": "float64",
      "nullable": true,
      "description": "Exact interpolated 95th percentile of delivered cohort transit time; null if none."
    },
    {
      "name": "updated_at",
      "type": "timestamp",
      "nullable": false,
      "description": "Deterministic snapshot cutoff (as_of); actual publication wall time is stored in the release manifest."
    }
  ],
  "freshness_sla": {
    "max_lag_seconds": 3600,
    "measurement": "Time from Kinesis arrival (or local simulated ingress) of newest eligible accepted input to successful publication of a snapshot that includes it. Also alert if scheduled publication heartbeat is overdue. Do not infer freshness from an unchanged business timestamp.",
    "objective_ratio": 0.99,
    "evaluation_window": "rolling_30_days",
    "enforcement": "target_unmeasured"
  },
  "completeness_sla": {
    "minimum_ratio": 0.999,
    "allowed_lateness_seconds": 172800,
    "denominator": "Distinct destination country, region and UTC outcome-date keys among effective DELIVERED and DELIVERY_FAILED events.",
    "measurement": "Accepted-population product coverage only: matched expected keys / expected keys at committed input high-water mark. Independent source completeness requires generator expected-ID manifest; unknown without source control totals. Empty denominator is not_applicable. Report rejected, orphaned, and pending records separately.",
    "enforcement": "target_unmeasured"
  },
  "quality_rules": [
    {
      "id": "required_key",
      "type": "not_null",
      "columns": [
        "country",
        "region",
        "metric_date"
      ],
      "parameters": {},
      "description": "Every row has a complete business key.",
      "severity": "error"
    },
    {
      "id": "unique_grain",
      "type": "unique",
      "columns": [
        "country",
        "region",
        "metric_date"
      ],
      "parameters": {},
      "description": "Published snapshot has one row per declared grain.",
      "severity": "error"
    },
    {
      "id": "publish_clock_sanity",
      "type": "timestamp_sanity",
      "columns": [
        "updated_at"
      ],
      "parameters": {
        "reference_column": null,
        "max_future_seconds": 300
      },
      "description": "Publication clock is not more than five minutes ahead of evaluation time.",
      "severity": "error"
    },
    {
      "id": "population_completeness",
      "type": "completeness",
      "columns": [
        "country",
        "region",
        "metric_date"
      ],
      "parameters": {
        "minimum_ratio": 0.999,
        "expected_population": "Distinct destination country, region and UTC outcome-date keys among effective DELIVERED and DELIVERY_FAILED events."
      },
      "description": "Compare expected and published keys using the same committed input snapshot after the lateness allowance.",
      "severity": "error"
    },
    {
      "id": "reliability_rate_bounds",
      "type": "numeric_range",
      "columns": [
        "on_time_delivery_rate",
        "failed_delivery_rate"
      ],
      "parameters": {
        "minimum": 0,
        "maximum": 1
      },
      "description": "Ratios have matching cohort denominators.",
      "severity": "error"
    }
  ],
  "lineage": {
    "sources": [
      "shipment_lifecycle",
      "silver.events"
    ],
    "transformation": "Aggregate delivery and failed-attempt outcomes by destination and outcome event date; retain counts for correct reaggregation. Never average percentages or percentile values.",
    "downstream_consumers": [
      "Regional service analysis",
      "Operational anomaly features",
      "Delivery reliability reporting"
    ]
  },
  "usage_metadata": {
    "intended_uses": [
      "Regional service analysis",
      "Operational anomaly features",
      "Delivery reliability reporting"
    ],
    "prohibited_uses": [
      "Representing real customers, company operations, or measured production adoption",
      "Financial settlement or physical stock reconciliation"
    ],
    "classification": "synthetic_public",
    "access_pattern": "Partition-pruned Parquet snapshots; Redshift serving projection where justified.",
    "retention_days": 90
  },
  "cost_metadata": {
    "measurement_status": "not_measured",
    "period_start": null,
    "period_end": null,
    "currency": "USD",
    "compute_usd": null,
    "storage_bytes": null,
    "allocation_method": "Storage by measured object bytes; shared job compute allocated by measured input bytes, explicitly an estimate. Report unallocated shared and AWS service charges separately."
  }
}
